{
  "boxes_evaluated": 200,
  "boxes_pruned": 0,
  "certified_unsat": false,
  "domain": {
    "max_width": "49/50",
    "x": [
      "1/100",
      "99/100"
    ],
    "y": [
      "1/100",
      "99/100"
    ]
  },
  "schema": "uniform.bivariate-exclusion-certificate/v1",
  "unresolved_boxes": [
    {
      "max_width": "49/800",
      "x": [
        "743/800",
        "99/100"
      ],
      "y": [
        "743/800",
        "99/100"
      ]
    },
    {
      "max_width": "49/800",
      "x": [
        "743/800",
        "99/100"
      ],
      "y": [
        "347/400",
        "743/800"
      ]
    },
    {
      "max_width": "49/800",
      "x": [
        "347/400",
        "743/800"
      ],
      "y": [
        "743/800",
        "99/100"
      ]
    },
    {
      "max_width": "49/800",
      "x": [
        "347/400",
        "743/800"
      ],
      "y": [
        "347/400",
        "743/800"
      ]
    },
    {
      "max_width": "49/800",
      "x": [
        "743/800",
        "99/100"
      ],
      "y": [
        "129/160",
        "347/400"
      ]
    },
    {
      "max_width": "49/800",
      "x": [
        "743/800",
        "99/100"
      ],
      "y": [
        "149/200",
        "129/160"
      ]
    },
    {
      "max_width": "49/800",
      "x": [
        "347/400",
        "743/800"
      ],
      "y": [
        "129/160",
        "347/400"
      ]
    },
    {
      "max_width": "49/800",
      "x": [
        "347/400",
        "743/800"
      ],
      "y": [
        "149/200",
        "129/160"
      ]
    },
    {
      "max_width": "49/800",
      "x": [
        "129/160",
        "347/400"
      ],
      "y": [
        "743/800",
        "99/100"
      ]
    },
    {
      "max_width": "49/800",
      "x": [
        "129/160",
        "347/400"
      ],
      "y": [
        "347/400",
        "743/800"
      ]
    }
  ],
  "unresolved_count": 98
}
